{
  "schema_version": 1,
  "dataset": {
    "artifact_sha256": "sha256:0000000000000000000000000000000000000000000000000000000000000000",
    "direct_nuisance_total": 549,
    "reactive_total": 1225,
    "normal_total": 19659
  },
  "evaluation_policy": {
    "version": "1.0.0",
    "content_sha256": "sha256:1111111111111111111111111111111111111111111111111111111111111111"
  },
  "candidates": [
    {
      "candidate_id": "kw_123e4567-e89b-42d3-a456-426614174000",
      "direct_nuisance_hits": 14,
      "reactive_hits": 0,
      "normal_hits": 0,
      "precision_excluding_reactive": 1.0,
      "direct_recall_contribution": 0.025501,
      "normal_hit_rate": 0.0,
      "utility_score": 14,
      "recommendation": "高推奨",
      "publication_status": "published"
    }
  ]
}
